{
  "iolRefractivePowerSphericalEquivalent": 24.5,
  "iolRefractivePowerSphere": 23.375,
  "iolRefractivePowerCylinder": 2.25,
  "iolRefractivePowerAxis": 100.0,
  "residualRefractionSphericalEquivalent": 0.06,
  "residualRefractionSphere": 0.32,
  "residualRefractionCylinder": -0.52,
  "residualRefractionAxis": 0.0,
  "residualRefractionAxisFlipping": true
}